{
  "contract_version": "1.1.0",
  "status": "normative",
  "schema": "specs/v1/stable-core-scalability.schema.json",
  "reduction": {
    "stable_mode": "sequential-fixed-input-order",
    "order": "sample-major then strategy-major with estimator-declared online or direct accumulation",
    "parallel_mode": "unsupported",
    "unsupported_error": "backend_unavailable",
    "promotion_gate": "fixed-partition-indexed-partials-and-fixed-tree-reduction-with-cross-worker-fixtures"
  },
  "rng": {
    "method_id": "evsi-nested-mc",
    "algorithm": "xorshift64-star-v1",
    "stream_identity": "seed,resample-index",
    "splitting_rule": "seed-xor-(resample-index+1)-times-mix64",
    "zero_seed_rule": "replace-zero-state-with-mix64-before-xorshift",
    "parallel_execution": "unsupported",
    "implementation": "rust/crates/voiage-numerics/src/evsi.rs",
    "promotion_gate": "parallel resamples must preserve indexed stream identity and fixed-index reduction bitwise on the same platform"
  },
  "streaming": {
    "stable_rust_input": "materialized-sample-containers",
    "out_of_core": "unsupported",
    "python_chunk_hint": "compatibility-orchestration-not-rust-streaming",
    "unsupported_error": "backend_unavailable",
    "promotion_gate": "versioned chunk schema, exact merge algebra, bounded-memory evidence, interruption recovery, and materialized-result parity"
  },
  "resource_profiles": [
    {
      "method_id": "net-benefit",
      "memory_model": "O(values)+O(output); inputs are borrowed and output is materialized",
      "latency_evidence": "rust-foundational-v1 contract-only timing",
      "energy_evidence": "not-measured-no-claim"
    },
    {
      "method_id": "expected-loss",
      "memory_model": "O(samples*strategies) materialized input plus O(strategies) summaries",
      "latency_evidence": "rust-foundational-v1 contract-only timing",
      "energy_evidence": "not-measured-no-claim"
    },
    {
      "method_id": "evpi",
      "memory_model": "O(samples*strategies) materialized input plus O(strategies) summaries",
      "latency_evidence": "rust-foundational-v1 and python-c15-evpi-v1 unpaired budgets",
      "energy_evidence": "not-measured-no-claim"
    },
    {
      "method_id": "evppi-regression",
      "memory_model": "O(samples*(strategies+parameters))+O(parameters^2) fit workspace",
      "latency_evidence": "rust-foundational-v1 contract-only timing without regression budget",
      "energy_evidence": "not-measured-no-claim"
    },
    {
      "method_id": "evsi-nested-mc",
      "memory_model": "O(samples*strategies) input plus O(strategies) per-resample workspace",
      "latency_evidence": "rust-foundational-v1 native EVSI regression budget",
      "energy_evidence": "not-measured-no-claim"
    },
    {
      "method_id": "evsi-regression",
      "memory_model": "O(samples*(strategies+parameters))+O(parameters^2) fit workspace",
      "latency_evidence": "rust-foundational-v1 efficient-linear EVSI regression budget",
      "energy_evidence": "not-measured-no-claim"
    },
    {
      "method_id": "evsi-moment-matching",
      "memory_model": "O(samples*(strategies+parameters))+O(strategies+parameters^2) workspace",
      "latency_evidence": "rust-foundational-v1 moment-based EVSI regression budget",
      "energy_evidence": "not-measured-no-claim"
    },
    {
      "method_id": "enbs",
      "memory_model": "O(1) beyond the supplied EVSI result",
      "latency_evidence": "rust-foundational-v1 contract-only timing",
      "energy_evidence": "not-measured-no-claim"
    },
    {
      "method_id": "ceaf",
      "memory_model": "O(samples*strategies*thresholds) input plus O(strategies*thresholds) summaries",
      "latency_evidence": "rust-foundational-v1 contract-only timing",
      "energy_evidence": "not-measured-no-claim"
    },
    {
      "method_id": "dominance",
      "memory_model": "O(strategies) inputs and frontier workspace",
      "latency_evidence": "rust-foundational-v1 contract-only timing",
      "energy_evidence": "not-measured-no-claim"
    },
    {
      "method_id": "structural-voi",
      "memory_model": "O(models*samples*strategies) materialized model inputs plus O(models+strategies) summaries",
      "latency_evidence": "no stable regression budget; performance claim prohibited",
      "energy_evidence": "not-measured-no-claim"
    }
  ]
}
